{
  "schema_version": "1.0",
  "event_id": "11111111-1111-4111-8111-111111111111",
  "producer_id": "simulator-local-01",
  "equipment_id": "evolver-sim-01",
  "vial_id": "vial-01",
  "experiment_run_id": "run-2026-10-27-a",
  "measurement_type": "temperature",
  "value": 36.8,
  "generated_at": "2026-10-27T13:00:00Z",
  "sequence": 42
}
